{
    "id": "strkstaking",
    "displayName": "STRK Staking",
    "host": "braavos.app",
    "description": "Stark Staking allows you to stake your STRK tokens and enjoy staking rewards",
    "categories": ["defi"],
    "contracts": [
        {
            "tag": "strk_staking_contract",
            "addresses": {
                "mainnet-alpha": [
                    "0xca1702e64c81d9a07b86bd2c540188d92a2c73cf5cc0e508d949015e7e84a7"
                ],
                "sepolia-alpha": [
                    "0x3745ab04a431fc02871a139be6b93d9260b0ff3e779ad9c8b377183b23109f1"
                ]
            }
        },
        {
            "tag": "braavos_staking_pool",
            "name": "Braavos",
            "addresses": {
                "mainnet-alpha": [
                    "0x1f170bafce432964d6cbaf2cb75355b2043f5640897e0623b7dbb029bf6b3ef"
                ],
                "sepolia-alpha": [
                    "0x30bbb25449b910ca6b8cb5de138a34cad956df326fc697623ff6b856e657377"
                ]
            },
            "icon": "https://raw.githubusercontent.com/myBraavos/starknet-meta/main/repository/strkstaking/braavos_pool_icon.svg"
        },
        {
            "tag": "karnot_staking_pool",
            "name": "Karnot",
            "addresses": {
                "mainnet-alpha": [
                    "0x7d695337550e96e1372dd03274965cca0284ded266efc1774d001d37fbca104"
                ]
            },
            "icon": "https://raw.githubusercontent.com/myBraavos/starknet-meta/main/repository/strkstaking/karnot_pool_icon.svg"
        },
        {
            "tag": "satoshi_university_staking_pool",
            "name": "Satoshi University",
            "addresses": {
                "mainnet-alpha": [
                    "0x69bd0141acecdc330ff8daf8f70f3ccad984ce3a8f015b7386f870309f7da63"
                ]
            }
        },
        {
            "tag": "avnu_staking_pool",
            "name": "AVNU",
            "addresses": {
                "mainnet-alpha": [
                    "0x362dc7da60bfddc8e3146028dfd94941c6e22403c98b5947104e637543b475d"
                ]
            },
            "icon": "https://raw.githubusercontent.com/myBraavos/starknet-meta/main/repository/strkstaking/avnu_pool_icon.svg"
        },
        {
            "tag": "nimbora_staking_pool",
            "name": "Nimbora",
            "addresses": {
                "mainnet-alpha": [
                    "0x1d1ba466d60c0288dcb2a52b406bacc14c655d7ea98503e9dcdaaff59ed19db"
                ]
            },
            "icon": "https://raw.githubusercontent.com/myBraavos/starknet-meta/main/repository/strkstaking/nimbora_pool_icon.svg"
        },
        {
            "tag": "p2p_staking_pool",
            "name": "P2P.org",
            "addresses": {
                "mainnet-alpha": [
                    "0x7c744f9bfc2555505dd92399048ec792886a822b26a828496405a57e30a0e0d"
                ]
            },
            "icon": "https://raw.githubusercontent.com/myBraavos/starknet-meta/main/repository/strkstaking/p2p_pool_icon.svg"
        },
        {
            "tag": "infstones_staking_pool",
            "name": "InfStones",
            "addresses": {
                "mainnet-alpha": [
                    "0x6cc852d7752e9e69cd4d3e02b1cbcdd4dd9607511a74efb3d90f2490d8b4240"
                ]
            },
            "icon": "https://raw.githubusercontent.com/myBraavos/starknet-meta/main/repository/strkstaking/infstones_pool_icon.svg"
        },
        {
            "tag": "teku_staking_pool",
            "name": "Teku",
            "addresses": {
                "mainnet-alpha": [
                    "0x1c202d2a02866c57d4950a461c1e870ace37a07ebcf2d92c62764f768233692"
                ]
            },
            "icon": "https://raw.githubusercontent.com/myBraavos/starknet-meta/main/repository/strkstaking/teku_pool_icon.svg"
        }
    ]
}
