{
  "id": "lootsurvivor",
  "displayName": "Loot Survivor",
  "host": {
    "goerli-alpha": "goerli-survivor.realms.world",
    "mainnet-alpha": "survivor.realms.world",
    "sepolia-alpha": "sepolia-survivor.realms.world"
  },
  "description": "Loot Survivor is an onchain Arcade machine game, first of the Play2Die franchise. You add some tokens, try to get the highscore and live for eternity onchain.",
  "categories": [
    "gamefi", "nft", "mobile"
  ],
  "contracts": [
    {
      "tag": "loot_survivor_game",
      "addresses": {
        "goerli-alpha": [
          "0x071d07b1217cdcc334739a3f28da75db05d62672ad04b9204ee11b88f2f9f61c"
        ],
        "mainnet-alpha": [
          "0x03c10537fa0073b2dd5120242697dbf76d6173eb9f384d3bf3d284d53388a0b0"
        ],
        "sepolia-alpha": [
          "0x0713063bab72fb1ff6aa279f53962f3adf0154305b194da42e8d20562f61c5fd"
        ]
      }
    },
    {
      "tag": "loot_survivor_beasts",
      "addresses": {
        "goerli-alpha": [
          "0x05c909139dbef784180eef8ce7a2f5bf52afe567aa73aaa77b8d8243ad5b6b96"
        ],
        "mainnet-alpha": [
          "0x0158160018d590d93528995b340260e65aedd76d28a686e9daa5c4e8fad0c5dd"
        ],
        "sepolia-alpha": [
          "0x03065c1db93be057c40fe92c9cba7f898de8d3622693d128e4e97fdc957808a3"
        ]
      }
    },
    {
      "tag": "loot_survivor_golden_token",
      "addresses": {
        "goerli-alpha": [
          "0x003583470a8943479f8609192da4427cac45bdf66a58c84043c7ab2fc722c0c0"
        ],
        "mainnet-alpha": [
          "0x04f5e296c805126637552cf3930e857f380e7c078e8f00696de4fc8545356b1d"
        ],
        "sepolia-alpha": [
          "0x024f21982680442892d2f7ac4cee98c7d62708b04fdf9f8a0453415baca4b16f"
        ]
      }
    },
    {
      "tag": "lords",
      "addresses": {
        "goerli-alpha": [
          "0x05e367ac160e5f90c5775089b582dfc987dd148a5a2f977c49def2a6644f724b"
        ],
        "mainnet-alpha": [
          "0x0124aeb495b947201f5fac96fd1138e326ad86195b98df6dec9009158a533b49"
        ],
        "sepolia-alpha": [
          "0x044e6bcc627e6201ce09f781d1aae44ea4c21c2fdef299e34fce55bef2d02210"
        ]
      }
    }
  ]
}